Test Case,Result,Details,Test Type,Severity,Timestamp
API Response Validation,PASS,No API endpoints found to test response validation,API,LOW,2025-09-23 14:48:37
API Performance,PASS,No API endpoints found to test performance,Performance,LOW,2025-09-23 14:48:50
API Authentication,PASS,No protected endpoints found to test authentication,Security,LOW,2025-09-23 14:48:56
API Login Validation,PASS,No login endpoints found to test authentication,Security,LOW,2025-09-23 14:49:02
API Data Validation,PASS,No POST endpoints found to test data validation,API,LOW,2025-09-23 14:49:10
